Nhãn,Features
Van phong,"kích_thước gọn 14 inch trọng_lượng 15 kg cpu intel core i5 - 13500h mạnh_mẽ cân tác vụ văn_phòng : word , excel , powerpoint ,  card đồ_họa tích_hợp intel uhd graphics thước phim hấp_dẫn , sắc nét ram 16gb ddr4 hoàn_thành đa tác vụ một_cách mượt_mà ổ_cứng 512gb ssd tốc_độ siêu giúp_việc khởi_động , tắt máy chạy ứng_dụng cực màn_hình cảm_ứng đa , độ trễ hỗ_trợ sử_dụng bút cảm_ứng cực tiện_lợi "
Van phong,"chip core i5 - 1235u card intel iris xe graphics chạy mượt_mà tác vụ văn_phòng , game nhẹ chỉnh_sửa ảnh cơ_bản pts  ram 8gb , ổ_cứng ssd 512gb tốc_độ xử_lý đa_nhiệm mượt_mà  màn_hình full hd , kích_thước chuẩn 156 inch , tn , 250nits chống chói bảo_vệ mắt , chất_lượng hiển_thị sắc nét  tích_hợp webcam 720p phép đàm_thoại thông_qua video thoải_mái  thiết_kế vỏ nhựa cứng_cáp , 163 kg thuận_tiện di_chuyển ,  máy đi kèm windows 11 bản_quyền  "
Sinh vien,"thiết_kế thanh_lịch , tao_nhã cân nhẹ vỏn_vẹn 141 kg màn_hình 14 inch full hd viền máy thu cảm_giác góc mở_rộng cân tác vụ học_tập , làm_việc phần_mềm office word , excel , powerpoint , cpu intel core i3 1115g4 có_thể nâng_cấp ram tối_đa 16 gb hỗ_trợ mượt_mà 10 tab chrome trang_bị đầy_đủ cổng kết_nối usb 32 , hdmi , usb 20 , usb type - c , giúp dễ_dàng kết_nối thiết_bị tương_thích "
Van phong,"sở_hữu thiết_kế tinh_tế tone màu đen sang_trọng trọng_lượng 173 kg hỗ_trợ xử_lý gọn tác vụ văn_phòng word , excel , powerpoint , cpu intel core i5 - 1235u card intel uhd graphics giúp chỉnh_sửa hình_ảnh cơ_bản ram 8gb ổ_cứng 512gb ssd hỗ_trợ lưu_trữ file , tài_liệu ,  màn_hình 156 inch full hd giúp giải_trí , làm_việc màu_sắc sống_động , chân_thực "
Sinh vien,"màn_hình 156 inch full hd hình_ảnh sắc nét , màu_sắc chính_xác vi xử_lý intel core i5 1335u mạnh_mẽ chạy đa tác vụ mượt_mà card tích_hợp intel iris xe graphics giúp cải_thiện hiệu_suất xử_lý đồ_họa như_chơi game cơ_bản ram 16 gb ddr4 cung_cấp khả_năng đa_nhiệm trơn_tru tốc_độ truyền dữ_liệu ổ_cứng ssd 512 gb giúp máy khởi_động , tải ứng_dụng tập_tin tức_thì "
Van phong,"sở_hữu màu đen sang_trọng , thanh_lịch , dễ_dàng che đi vết bẩn , trọng_lượng laptop nhẹ , 175 kg cpu r5 - 7530u thích_hợp giải_quyết công_việc văn_phòng , lướt web xử_lý ảnh nhẹ màn_hình 156 inch full hd giúp có_thể trải nghiệm hình_ảnh , chân_thật ram 16gb giúp tab , hỗ_trợ quá_trình làm_việc trở_nên hiệu_quả ổ_cứng ssd 512gb phép lưu_trữ dữ_liệu sao_chép usb "
Sinh vien,"ram 8 gb - mở_hàng_loạt cửa_sổ trình_duyệt , ổ_cứng 512 ssd lưu_trữ thoải_mái công_nghệ stereo speaker - chất âm rõ_ràng đa_nhiệm mượt_mà ram 8gb , 512gb ssd phản_hồi nhanh_chóng dày 199 mm , 17 kg - phù_hợp "
Van phong,"sở_hữu thiết_kế tối_giản thiết_kế gọn_nhẹ khối_lượng 175 kg có_thể máy gọn_gàng balo bất_kì , lớp_học cơ_quan bất_kì trở_ngại  màn_hình 156 inch , độ phân_giải full hd , chất_lượng hình_ảnh sắc nét , sống_động màn_hình đảm_bảo giây_phút giải_trí hoàn_hảo  vi xử_lý intel core i7 - 1260p cực_kì mạnh_mẽ cải_tiến vượt_bậc giúp tiết_kiệm năng_lượng kéo_dài đáng_kể thời_gian sử_dụng  8gb ram khả_năng đa_nhiệm mượt_mà , có_thể đồng_thời tab ứng_dụng phục_vụ công_việc xảy tình_trạng giật , lag  ổ_cứng dung_lượng 512gb không_gian lưu_trữ đồng_thời giúp khởi_động máy ứng_dụng trở_nên nhanh_chóng  touchpad diện_tích rộng , phủ lớp nhám mịn giúp thao_tác chuột trở_nên thuận_tiện "
Sinh vien,"sở_hữu thiết_kế gọn_gàng đơn_giản lớp vỏ bạc bóng màn_hình 14 inch fullhd chất_lượng hiển_thị rõ_ràng , sắc nét cpu intel core i5 - 8350u đồ_họa intel uhd graphics 620 hỗ_trợ làm_việc , chỉnh_sửa ảnh đơn_giản , giải_trí mượt_mà 8gb ram giúp duyệt web nhanh_chóng lo giật , lag ổ_cứng 256gb ssd không_gian lưu_trữ "
Van phong,"sở_hữu thiết_kế mỏng nhẹ 999g giúp dễ_dàng chip i5 - 1340p intel iris xe graphics giúp chỉnh_sửa hình_ảnh pts công_việc văn_phòng màn_hình 14 inch độ phủ màu dci - p3 99 % kết_hợp độ phân_giải wuxga giúp hình_ảnh trở_nên chân_thật , nét âm_thanh hd kết_hợp dolby atmos giúp giây_phút trải nghiệm âm_nhạc tuyệt_vời "
Van phong,"sở_hữu thiết_kế nổi_bật lớp vỏ phủ màu vàng gold sang_trọng , kích_thước máy cực gọn_nhẹ vỏn_vẹn 141 kg  màn_hình 14 inch full hd đi ips góc rộng 178 độ góc chất_lượng hình_ảnh bóp_méo  cpu intel core i5 - 1235u kết_hợp card intel iris xe graphics đa_nhiệm , giải_quyết tác vụ học_tập , văn_phòng : word , excel , powerpoint , hỗ_trợ chỉnh_sửa hình_ảnh cơ_bản phần_mềm lightroom , photoshop ,  trang_bị ram 8 gb ổ_cứng 256 gb pcie nvme m 2 ssd giúp mở_rộng không_gian lưu_trữ đồng_thời hỗ_trợ tab duyệt web khởi_động máy , ứng_dụng tích_tắc  máy hỗ_trợ cổng kết_nối thông_dụng : usb type - c , usb type - a , hdmi 20 , jack tai_nghe / mic , giúp truyền file , chia_sẻ dữ_liệu nhanh_chóng "
Van phong,"sử_dụng cpu intel core i5 6300u giúp xử_lý tác vụ văn_phòng trang_bị cổng kết_nối giúp quá_trình truyền xuất dữ_liệu trở_nên dễ_dàng , thông_dụng : thẻ_nhớ micro sd , cổng usb type - c ,  màn_hình 14 inch kết_hợp độ phủ màu 100 % srgb chất_lượng hiển_thị hình_ảnh trở thiết_kế laptop sang_trọng , mỏng nhẹ , trọng_lượng chi 113 kg , thích_hợp sinh_viên ram 8gb kết_hợp ổ_cứng ssd giúp tab chứa dữ_liệu "
Van phong,"hiệu_năng nâng_cấp mạnh_mẽ ryzen 5 - 5625u tích_hợp 16gb ram trang_bị đầy_đủ hệ_thống cổng kết_nối cổng usb 32 gen 1 , usb 32 gen 2 type - c , hdmi 14 , jack cắm 35 mm khe cắm thẻ sd  thiết_kế sang_trọng , gọn_nhẹ 154 kg thích_hợp đi khắp  không_gian hiển_thị tối_ưu công_nghệ dolby vision hiệu_ứng màu đen độ sâu chói nội_dung hdr "
Sinh vien,"sở_hữu thiết_kế mỏng nhẹ chắc_chắn màn_hình led 156 inch sắc nét , làm_việc , giải_trí thoải_mái cpu intel core i5 - 6200u đồ_họa intel hd graphics 520 đáp_ứng nhu_cầu học_tập , làm_việc dung_lượng 500 gb không_gian lưu_trữ tài_liệu , hình_ảnh , nhạc , phim ,  trang_bị đầy_đủ cổng kết_nối thông_dụng dễ_dàng kết_nối , truyền_tải dữ_liệu "
Sinh vien,"trang_bị màn_hình viền siêu mỏng , trọng_lượng 175 kg thích_hợp cpu r7 7730u giúp dễ_dàng xử_lý tác vụ văn_phòng chỉnh ảnh nhẹ màn_hình 156 inch full hd giúp chất_lượng hình_ảnh hiển_thị chân_thật trang_bị cổng kết_nối giúp quá_trình xuất / nhập dữ_liệu trở_nên dễ_dàng , nhanh_chóng ram 16gb ổ_cứng ssd 512gb giúp lưu_trữ dữ_liệu lag quá_trình sử_dụng "
Gaming,"sở_hữu thiết_kế cá_tính đậm chất laptop gaming màn_hình 156 inch đem khung hình game sống_động , chìm_đắm cpu intel core i5 11400h cân tác vụ game sử_dụng ứng_dụng chuyên_nghiệp ram 16gb ddr4 khả_năng đa_nhiệm vượt_trội , game phát_sóng trực_tiếp lo vấn_đề giật lag ổ_cứng 512gb khả_năng lưu_trữ khổng_lồ , thoải_mái lưu_trữ tựa game ứng_dụng yêu_thích "
Gaming,"laptop gaming thiết_kế mỏng nhẹ đi lớp áo đen huyền_bí , trọng_lượng siêu nhẹ dòng laptop gaming 186 kg dễ_dàng đi  cpu intel core i7 - 11800h card đồ_họa rtx 3050 cân tựa game phổ_biến hiện_nay đồ_họa medium hight thua kèm pc gaming  laptop ram 8gb ddr4 ổ_cứng 512gb đa_nhiệm mượt_mà , không_gian lưu_trữ , máy nhanh_chóng , thao_tác gọn lo lag , giật  màn_hình 156 inch , độ phân_giải full hd ips khung hình chi_tiết , sắc nét tần_số quét 144hz giúp thao_tác xoay , lướt nhanh_chóng giúp game thủ dễ_dàng hạ đối_thủ , chiến_thắng tựa game  máy trang_bị cổng kết_nối : usb type - c , usb type - a , hdmi , rj45 , hỗ_trợ kết_nối , truyền , tải dữ_liệu nhanh_chóng "
Sinh vien,"thiết_kế pin thời_lượng sử_dụng cực khủng 303 bàn_phím linh_hoạt , hành_trình phím sâu , độ nảy cực hiệu_suất mạnh_mẽ , cân tác vụ văn_phòng cpu intel core i7 - 8650u ram 32gb ổ_cứng ssd 1tb bật hàng chục tab chrome chạy mượt_mà , trơn_tru , giật lag màn_hình 14 inch hd cực sắc nét , hỗ_trợ làm_việc , giải_trí nhanh_chóng "
Sinh vien,"thiết_kế laptop mỏng nhẹ gam màu sang_trọng , trọng_lượng 14 kg , thích_hợp cpu intel core i9 - 13900h giúp xử_lý mượt_mà tác vụ văn_phòng xử_lý hình_ảnh nhẹ ổ_cứng ssd 512gb không_gian lưu_trữ , giúp lo cất_giữ dữ_liệu , tài_liệu màn_hình 14 inch kết_hợp độ phủ màu dci - p3 100 % giúp trải nghiệm hình_ảnh , video trở_nên sác nét , sống_động "
Sinh vien,"xử_lý intel core i5 - 1240p mạnh_mẽ , xử_lý tác vụ từ_học_tập văn_phòng  ram 8gb ddr4 khả_năng xử_lý đa_nhiệm công_việc  màn_hình kích_thước 16 inch giúp thoải_mái làm_việc hình_ảnh sắc nét màu_sắc chân_thực sống_động độ phân_giải fullhd nghệ chống chói anti glare  bàn_phím hỗ_trợ led tiện_lợi sử_dụng giúp sử_dụng điều_kiện  máy đi kèm windows 11 sl bản_quyền "
Sinh vien,"cpu intel core i5 1135g7 cân tác vụ học_tập , văn_phòng ram 8 gb ddr4 phép chạy đồng_thời chương_trình lag , giật ổ_cứng ssd 512 gb cung_cấp không_gian lưu_trữ rộng_lớn tập_tin màn_hình 156 inch full hd độ nét hình_ảnh sắc nét "
Gaming,"siêu phẩm game thủ màn_hình rộng 156 inch lớp vỏ đen cá_tính cpu intel core i5 - 12500h cân tác vụ nhẹ văn_phòng giải_trí vga rtx 4050 mạnh_mẽ thao_tác đồ_họa cực mượt tần_số quét 144hz giúp thao_tác game gọn lo giật , xé hình ram 8gb kết_hợp ổ_cứng 512gb ssd không_gian lưu_trữ thoải_mái , máy tích_tắc "
Sinh vien,"laptop hoc tập văn_phòng cpu intel core i5 2520m cân tác vụ văn_phòng card đồ_họa intel hd graphics 3000 phép xử_lý hình_ảnh cơ_bản ram 4gb mượt_mà , hỗ_trợ duyệt web nhanh_chóng ổ_cứng 512 gb hdd không_gian lưu_trữ rộng_rãi màn_hình 14 inch độ phân_giải hd không_gian làm_việc , giải_trí thoải_mái "
Van phong,"xử_lý tác vụ nặng_nề , thoả sức giải_trí tựa game esport - amd ryzen 5 - 5600h card đồ_hoạ amd radeon ™ graphics ram 8gb , ổ_cứng ssd 512gb tốc_độ xử_lý đa_nhiệm mượt_mà , trang giật , lag  độ phân_giải 28 k , màn_hình 140 inch , oled , tần_số quét 90hz chất_lượng hiển_thị nét , mượt_mà  cổng kết_nối đa_dạng - thuận_tiện  năng_lượng bất_tận viên pin 63whrs , 3s1p , 3 - cell li - ion  thiết_kế mỏng nhẹ , sang_trọng thuận_tiện di_chuyển , trọng_lượng 13 kg máy đi kèm windows 11 bản_quyền "
Van phong,"thiết_kế thời_thượng - vỏ nhôm cao_cấp , nhẹ 149 kg 16gb ram , chip intel core i5 thế_hệ 12 - hiệu_năng vượt_trội , ngại tác vụ 512gb ssd - giúp máy khởi_động , lưu_trữ file màn_hình độ phân_giải full hd chất_lượng hiển_thị sắc nét "
Sinh vien,"hiệu_năng ổn_định - chạy ứng_dụng văn_phòng , core i3 1215u đa_nhiệm - tích_hợp 8gb ram phép ứng_dụng đàm_thoại thả ga video call - trang_bị webcam 720p màn_hình 156 inch , chất_lượng hiển_thị rõ_ràng , thoải_mái làm_việc giải_trí "
Sinh vien,"sử_dụng chip i7 - 6600u card đồ_họa intel hd graphics 520 giúp xử_lý ổn thỏa tác vụ văn_phòng màn_hình 14 inch kết_hợp độ phân_giải full hd đem phút_giây trải nghiệm hình_ảnh sống_động ram 24gb giúp thỏa_thích tab lo lag máy dung_lượng ổ_cứng ssd 256 phép lưu trự dữ_liệu máy_tính kích_thước laptop mỏng nhẹ , 14 kg phép di_chuyển dễ_dàng , thoải_mái "
Sinh vien,"thiết_kế kiểu_dáng thanh_lịch , dễ_dàng - độ mỏng 168 mm nhẹ 999g chip i7 - 1360p kết_hợp card đồ_họa intel iris xe graphics phép thực_hiện công_việc văn_phòng chỉnh_sửa hình_ảnh pts trang_bị màn_hình 14 inch wuxga tích_hợp độ phủ màu dci - p3 99 % đem hình_ảnh , thước phim nét , chân_thật đa dang cổng kết_nối , giúp thuận_tiện công_việc dễ_dàng chia_sẻ - usb type c , usb type a , hdmi , dc - in "
Sinh vien,"chip i5 - 1340p card đồ_họa intel iris xe graphics giúp thực_hiện công_việc văn_phòng giải trị nhẹ ram 8gb ổ_cứng 256gb kết_hợp 2 khe cắm giúp lưu_trữ thông_tin , dữ_liệu màn_hình 140 inches độ phủ màu dci - p3 99 % đem chất_lượng hình_ảnh , video nét âm_thanh hd kết_hợp dolby atmos giúp giây_phút trải nghiệm âm_nhạc chân_thật , sống_động thiết_kế laptop mỏng nhẹ , trọn , trọng_lượng 999kg , thích_hợp "
Van phong,"amd ryzen 7 5825u , tốc_độ xử_lý nhanh_chóng card onboad amd radeon phép chiến tựa game esport ổ_cứng ssd 5126gb tốc_độ xử_lý đa_nhiệm mượt_mà , trang giật , lag  màn_hình 160 inches , độ phân_giải full hd ips chất_lượng hiển_thị nét , mượt_mà  ngại - bàn_phím trang_bị led  năng_lượng bất_tận viên pin 4 cell , 54 wh  thiết_kế mỏng nhẹ , sang_trọng thuận_tiện di_chuyển , - 1802 kg máy đi kèm windows 11 bản_quyền "
Gaming,"laptop gaming cpu amd ryzen 5 5600h mạnh_mẽ kết_hợp card màn_hình amd radeon rx 5500m 4 gb tựa game hiện_hành : gta v , lol , cs : go ,  ram 8 gb hỗ_trợ nâng_cấp 64 gb đa_nhiệm đáp_ứng công_việc hằng soạn_thảo văn_bản , học online , game , nhạc ,  ổ_cứng ssd 512 gb không_gian lưu_trữ , lưu 2 - 3 tựa game tập_tin công_việc , học_tập lo dung_lượng đi kèm tốc_độ truy_xuất dữ_liệu nhanh_chóng , máy 10 giây  màn_hình 156 inch độ phân_giải full hd sắc nét , góc rộng 178 độ công_nghệ ips giúp màu_sắc biến_đổi vị_trí  bàn_phím hành_trình phím sâu , độ nảy , đèn bàn_phím màu đỏ không_gian game phấn_khích  máy trang_bị hệ_thống tản_nhiệt , đem nhiệt_độ mát_mẻ , dễ_chịu sử_dụng "
Gaming,"mang_vẻ vô_cùng tân_tiến đường_nét mạnh_mẽ , cá_tính cpu intel core i5 - 12450h đảm_bảo tốc_độ xử_lý gọn gpu rtx 4050 tân tiến khả_năng xử_lý đa tác vụ , game làm_việc không_gian lưu_trữ rộng_rãi 512gb ssd , lưu_trữ tài_liệu , game phần_mềm màn_hình 156 inch full hd tần_số quét 144hz , đảm_bảo thao_tác mượt_mà , bắt kịp chuyển_động "
Sinh vien,"thiết_kế trọng_lượng nhẹ 125 kg dễ_dàng cpu intel core i5 - 1240p mạnh_mẽ cân tác vụ làm_việc , học_tập ram 16gb đa_nhiệm hỗ_trợ mở_hàng chục tabs web lo lag , giật ổ_cứng 512gb ssd rộng_rãi giúp lưu_trữ file , tài_liệu thoải_mái trang_bị kết_nối : usb 32 type - a , hdmi thunderbolt 4 giúp lưu , truyền_tải dữ_liệu tốc_độ "
Van phong,"màn_hình 14 inch kết_hợp tính_năng chống chói giúp đỡ đau mắt quá_trình sử_dụng cpu intel core i5 - 1335u giúp xử_lý công_việc văn_phòng xử_lý hình_ảnh nhẹ pts ổ_cứng ssd 256gb giúp có_thể lưu_trữ dung_lượng thiết_kế laptop mỏng nhẹ màu bạc sang_trọng , trọng_lượng 14 kg , thích_hợp "
Sinh vien,"thiết_kế cứng_cáp , sang_trọng màn_hình cảm_ứng 156 inch full hd cân tác vụ học_tập , văn_phòng cpu intel core i5 - 1135g7 card intel iris xe graphics hỗ_trợ lướt web , phim giải_trí tựa game nhẹ ram 8gb đa_nhiệm ổ_cứng 256gb ssd ccho không_gian lưu_trữ webcam hd 720p giúp hình_ảnh sắc nét họp , video call , meet , "
Gaming,"sở_hữu thiết_kế tinh_tế hầm_hố tone màu xanh đẹp_mắt , phân khúc mỏng nhẹ dòng laptop gaming trọng_lượng 226 kg  cpu intel core i7 - 12700h kết_hợp card đồ_họa rời nvidia geforce rtx rtx 3050ti 4gb cân tựa game hiện_đại , đồ_họa , render video tốc_độ mượt_mà nhanh_chóng bao_giờ  bộ_nhớ ram 16gb ổ_cứng ssd 512gb tốc_độ khởi_động , bật / tắt máy ứng_dụng giây  màn_hình 156 inch , độ phân_giải full hd ips độ sắc nét tốc_độ 144hz giúp tận_hưởng phim hành_động bom sắc nét tựa game online cường_độ nguyên chất_lượng hiển_thị  máy trang_bị đầy_đủ cổng kết_nối : usb type a , usb type c , jack cắm tai_nghe , hdmi , đảm_bảo trao_đổi dữ_liệu diễn một_cách nhanh_chóng "
Gaming,"thiết_kế đậm chất gaming cứng_cáp , hầm_hố độ hoàn_thiện màn_hình fullhd kích_thước chuẩn 15,6 inch , hiển_thị sắc nét , màu_sắc sống_động hiệu_năng mạnh_mẽ , đa_nhiệm mượt_mà - intel core i5 - 11400h , ram 8gb năng_lượng bất_tận viên pin 4 - cell , 575 wh "
Sinh vien,"đồng_hành tuyệt_vời sở_hữu kích_thước mỏng nhẹ 138 kg tông bạc sang_trọng sở_hữu chip i7 1255u mạnh_mẽ , chắc_hẳn đáp_ứng nhu_cầu văn_phòng hình_ảnh ram 16gb giúp tha_hồ tab lo giật lag ssd 512gb không_gian lưu_trữ rộng_lớn khả_năng khởi_động nhanh_chóng ứng_dụng màn_hình 14 inch full hd hình_ảnh chân_thật , nét "
Sinh vien,"sở_hữu thiết_kế tinh_tế vỏ màu bạc bóng màn_hình 14 inch full hd hình_ảnh thể_hiện rõ_ràng , sắc nét , màu_sắc trung_thực card đồ_họa tích_hợp intel uhd graphics đáp_ứng chỉnh ảnh , game cơ_bản ram 8gb ổ_cứng 256gb hỗ_trợ máy , lướt web nhanh_chóng trọng_lượng 148 kg dễ_dàng balo , khắp_nơi "
Gaming,""" chip i5 - 11400h tinh_vi card đồ_họa geforce rtx 3050 - thoả sức chiến game esport 60fps chỉnh_sửa hình_ảnh ram 8gb 1 khe cắm , nâng_cấp tối_đa 32gb ổ_cứng ssd không_gian lưu_trữ 512gb màn_hình 173 inches siêu rộng cảm_giác chân_thật , tích_hợp công_nghệ adaptive - sync màn_hình chống lóa tần_số quét 144hz tích_hợp loa kép công_nghệ dts âm_thanh chân_thực , sống_động bảo_mật khoá vật_lý kensington mật_khẩu bảo_vệ quản_trị viên bàn_phím trang_bị đèn led rgb sống_động thiết_kế vỏ nhựa cứng_cáp trọng_lượng máy 26 kg cảm_giác cầm_chắc_tay máy đi kèm windows 11 home sl bản_quyền "" "
Gaming,"chiến game đồ_họa trung_bình - , 2d , 3d card đồ_họa nvidia geforce rtx 3050 cpu r5 - 4600h hỗ_trợ giải_quyết gọn tác vụ văn_phòng word , excel ,  bộ_nhớ ram 8gb , có_thể nâng_cấp 32gb ổ_cứng ssd 512gb giúp máy tích_tắc không_gian lưu_trữ tích_hợp công_nghệ chống ồn công_nghệ âm_thanh dts - trở_ngại nhiễu âm_thanh , chất_lượng âm_thanh rõ_ràng đậm chất thiết_kế gaming vẻ chắc_chắn công_nghệ chống chói màn_hình tần_số 144hz trải nghiệm tuyệt_đối game bàn_phím trang_bị đèn 1 - zone rgb - thỏa_sức game điều_kiện thiếu_sáng sẵn hệ điều_hành windows 11 home bản_quyền "
Van phong,"thoải_mái xử_lý công_việc giải_trí thỏa_thích tiết_kiệm năng_lượng chip i5 - 1240p ram 16gb ổ_cứng 512gb lo giật lag , bộ_nhớ siêu khủng , truy_xuất dữ_liệu nhanh_chóng dễ_dàng hoàn_thành tác vụ văn_phòng cơ_bản học_tập card đồ_họa intel iris xe _vẻ bắt_mắt màn_hình siêu 16 inches - phim thỏa_thích trọng_lượng lap 18 kg - thuận_tiện , dễ_dàng cầm nắm sẵn hệ điều_hành windows 11 home bản_quyền "
Gaming,"cpu intel core i9 - 12900hk mạnh_mẽ dễ_dàng chiến_thắng tựa game aaa hoàn_thành_công_việc hoàn_toàn chiếu alienfx có_thể lập_trình tối_đa 16,8 triệu màu riêng_biệt card đồ_hoạ nvidia geforce rtx 3080ti trải nghiệm game đỉnh_cao , hiệu_năng mạnh_mẽ ram 32gb ddr5 thao_tác mượt_mà , game , dựng_phim render hình_ảnh 3d trơn_tru ổ_cứng ssd 1tb phản_hồi nhanh_chóng , tệp dữ_liệu tựa game bom tải giây "
Van phong,"sở_hữu thiết_kế sang_trọng , trọng_lượng nhẹ , dễ_dàng ram 16gb giúp dễ_dàng tab lo lag máy cứng ssd 512gb giúp không_gian lưu_trữ sở_hữu cảm_biến vân giúp thao_tác mở_màn_hình thuận_tiện "
Van phong,"sở_hữu thiết_kế tối_giản lớp vỏ màu đen_tuyền cpu intel core i7 1355u chạy mượt tất_cả tác vụ cơ_bản chuyên_sâu đồ_họa intel iris xe hiệu_suất , phép chỉnh_sửa hình_ảnh cơ_bản ram 16gb mượt_mà , cân hàng chục tabs chrome giật , lag ổ_cứng 512gb ssd hỗ_trợ lưu_trữ dữ_liệu lo dung_lượng màn_hình 156 inch full hd hiển_thị sắc nét , trong_trẻo , màu_sắc chính_xác "
Van phong,"thiết_kế nguyên khối thanh_lịch sang_trọng , trọng_lượng máy nhẹ 15 kg cpu intel core i5 - 1135g7 khả_năng xử_lý tác vụ một_cách nhanh_chóng hiệu_quả ổ_cứng 256gb thoải_mái tải file , phần_mềm , dữ_liệu học_tập ram 8gb giúp chuyển_đổi qua_lại tab lo lag , giật màn_hình 14 inch , độ phân_giải hd giúp tái_hiện_hình_ảnh nét hd webcam hỗ_trợ hình_ảnh sắc nét họp , call video , meet , "
Van phong,"chip core i5 - 1135g7 tiết_kiệm pin , hiệu_năng ổn_định thích_hợp văn_phòng  ổ_cứng ram 8gb , ssd 512gb - lo tràn ram khởi_động máy chậm sử_dụng màn_hình độ phân_giải lớp phủ chống chói - hiển_thị điều_kiện ánh_sáng  tích_hợp webcam hd phép đàm_thoại thông_qua video thoải_mái  năng_lượng bất_tận viên pin 3cell 42whrs  thiết_kế mỏng nhẹ - 196 kg , đồng_hành khắp  máy đi kèm windows 10 bản_quyền "
Van phong,"cpu r5 - 7530u hỗ_trợ tối_đa tác vụ văn_phòng chỉnh_sửa ảnh nhẹ màn_hình 14 inch viền mỏng đem ấn_tượng hình_ảnh , video ram 16gb hỗ_trợ tab lo lag máy ổ_cứng ssd 512gb phép lưu_trữ thông_tin , dữ_liệu máy_tính thiết_kế màu đen tinh_tế , sang_trọng , trọng_lượng nhẹ 14 kg , dễ_dàng "
Van phong,"chip core i5 - 1135g7 tiết_kiệm pin , hiệu_năng ổn_định thích_hợp văn_phòng  ram 4gb , 2 cắm phép nâng_cấp tối_đa 16gb , ổ_cứng ssd 512gb tốc_độ xử_lý đa_nhiệm mượt_mà  công_nghệ chống chói anti glare - làm_việc lo mỏi_mắt  đa_dạng cổng kết_nối : jack cắm audio , cổng hdmi 14 , cổng usb c , truyền xuất dữ_liệu thiết_bị  công_nghệ realtek alc3204 - khả_năng khuếch_đại giúp tận_hưởng âm_thanh rõ_ràng  thiết_kế vỏ nhựa cứng_cáp , 17 kg thuận_tiện di_chuyển ,  máy đi kèm windows 10 bản_quyền "
Sinh vien,"màn_hình 14 inch full hd giúp tái_tạo_hình_ảnh màu_sắc tươi_tắn độ chi_tiết cpu intel core i5 1335u đáp_ứng mượt_mà tác vụ word , excel , sửa ảnh cơ_bản ram 16 gb mượt_mà , qua_lại ứng_dụng lo lag , giật ổ_cứng ssd 512 gb nvme pcie tốc_độ truy_xuất dữ_liệu , khởi_động máy nhanh_chóng hệ_thống loa b & o tích_hợp công_nghệ realtek high definition audio nâng trải nghiệm giải_trí "
Sinh vien,"chip intel core i7 - 1260p card đồ_họa intel iris xe graphics phù_hợp dân văn_phòng , chỉnh_sửa ảnh pts ram 16gb ổ_cứng 256gb ssd + 1 khe_cắm - hiệu_năng mượt_mà tác vụ màn_hình lcd 170 inches độ phân_giải wqxga độ phủ màu dci - p3 99 % chất_lượng hiển_thị hình_ảnh nét âm_thanh hd dts x ultra đem trải nghiệm âm_thanh chân_thật , sống_động tích_hợp webcam ir fhd ir phép đàm_thoại thông_qua video thoải_mái tính_năng bảo_mật ssd , ftpm / hw tpm , webcam & phím nóng tắt micrô khóa kensington mỏng đem bảo_mật riêng_tư tuyệt_đối thiết_kế vỏ kim_loại chắc_chắn , 1,350 kg thuận_tiện di_chuyển  "
Van phong,"sở_hữu thiết_kế hiện_đại , màu xám trẻ_trung , tinh_tế bản_lề 180 độ dễ_dàng trình_bày nội_dung , chia_sẻ thông_tin đối_diện màn_hình 156 inch full hd khung hình rộng_lớn , sắc nét cpu intel core i5 - 1155g7 hoạt_động ổn_định , hiệu_suất , tiết_kiệm pin ram 8gb giúp có_thể làm_việc chục tabs lo_sợ giật lag trọng_lượng 16 kg dàng túi_xách balo di_chuyển khắp "
