Nhãn,Features
Sinh vien,"mang_vẻ sang_trọng thiết_kế gọn_nhẹ , áp_lực vai cpu i5 1335u card đồ_họa intel uhd giúp xử_lý ổn thỏa tác vụ văn_phòng ổ_cứng ssd 512gb ram 8gb giúp lưu_trữ dữ_liệu máy_tính chạy mượt laptop trang_bị cổng kết_nối giúp quá_trình sử_dụng trở_nên thuận_tiện : cổng type c , usb 20 , usb 32 , hdmi , "
Sinh vien,"sở_hữu chip amd r5 6600u xử_lý tác vụ hình_ảnh đồ_họa 2d nhẹ ram 16gb con_số thích_hợp tab làm_việc lo giật lag màn_hình 14 inch wuxga chất_lượng hình_ảnh , chân_thật thiết_kế laptop màu bạc sang_trọng trọng_lượng nhẹ 14 kg "
Sinh vien,"sở_hữu thiết_kế gọn_nhẹ 17 kg sẵn_sàng đi khắp_nơi giải_quyết tác vụ văn_phòng cpu intel core i5 - 1235u ram 16gb ổ_cứng 512gb ssd đa_nhiệm giúp duyệt web , máy , ứng_dụng nhanh_chóng màn_hình 156 inch full hd ips , hình_ảnh nét chất_lượng trang_bị đèn đơn_sắc hỗ_trợ thao_tác làm_việc thuận_lợi môi_trường thiếu_sáng "
Van phong,"thiết_kế laptop vỏ kim_loại sang_trọng , , trọng_lượng nhẹ 999g , thuận_tiện di_chuyển sử_dụng ram 16gb ổ_cứng 512gb trang_bị 2 khe cắm giúp không_gian lưu_trữ dữ_liệu màn_hình 14 inch độ phủ màu dci - p3 99 % giúp hình_ảnh , video trở_nên sống_động , nét trang_bị bàn_phím đèn led giúp dễ_dàng hoạt_động môi_trường thiếu_sáng "
Gaming,"chip amd ryzen ™ r5 - 5600h card rời rtx ™ 3050 xử_lý mượt_mà tựa game aaa phần_mềm đồ_hoạ pts , premier ram 8gb phép nâng_cấp tối_đa 32gb ổ_cứng ssd 256 gb - đa_nhiệm lưu_trữ dữ_liệu tiện_dụng , nhanh_chóng  công_nghệ chống chói - làm_việc lo mỏi_mắt màn_hình full hd kích_thước chuẩn 156 inch , tần_số quét 120hz giới_hạn 60fps đa_dạng cổng kết_nối : jack cắm audio , cổng hdmi 14 , cổng usb c , truyền xuất dữ_liệu thiết_bị pin cực_khỏe - 3cell 56whrs thời_gian sử_dụng bền_bỉ máy đi kèm windows 11 bản_quyền "
Sinh vien,"trang_bị intel core i5 1235u xử_lý tác vụ word , excel , powerpoint chỉnh_sửa hình_ảnh cơ_bản ram 8 gb khả_năng vận_hành ứng_dụng văn_phòng nhạc spotify , youtube tìm_kiếm thông_tin chrome ổ_cứng ssd 512 gb lưu_trữ tài_liệu học_tập công_việc màn_hình 14 inch ips thoải_mái , chia_sẻ thông_tin cạnh trang_bị chip tpm 20 khả_năng bảo_mật , bảo_vệ dữ_liệu an_toàn "
Van phong,"kích_thước 14 inch độ phân_giải hỗ_trợ hiển_thị hình_ảnh sắc nét vi xử_lý intel core i5 - 1340p trải nghiệm mượt_mà card intel iris xe graphics khả_năng xử_lý đồ_họa trơn_tru ram 16 gb giúp tab trình_duyệt giật , treo máy ổ_cứng ssd 512 gb dung_lượng lưu_trữ tốc_độ truy_xuất bảo_mật vân an_toàn tiện_lợi bảo giúp vệ dữ_liệu cá_nhân "
Van phong,"thiết_kế sang_trọng vỏ nhôm , 11 kg khoá 1 chạm , trang_bị bảo_mật vân 8gb ram onboard , hoạt_động mượt_mà , xử_lý tác vụ văn_phòng 512gb ssd - khởi_động máy , ứng_dụng nhanh_chóng "
Van phong,"màn_hình 156 inch oled khả_năng tái_tạo hoàn_hảo cpu intel core i5 - 13500h mạnh_mẽ có_thể xử_lý mượt_mà tác vụ card intel uhd trải nghiệm giải_trí ram 16 gb chạy đa ứng_dụng mượt_mà lo giật , lag ổ_cứng ssd 512 gb tốc_độ truy_xuất dữ_liệu , không_gian lưu_trữ "
Van phong,"khoác lớp vỏ màu bạc bóng , sang_trọng cân tác vụ học_tập , làm_việc cpu intel core i5 - 1235u vga intel iris xe graphics hỗ_trợ chỉnh_sửa hình_ảnh , game cơ_bản ram 8gb đa_nhiệm giúp duyệt web nhanh_chóng ổ_cứng 512gb pcie ssd rộng_rãi lưu_trữ file , tài_liệu học_tập "
Gaming,"chiến thần gaming - cân thể_loại game card đồ_họa nvidia geforce rtx 3070 ti siêu_khủng sở_hữu_hiệu_năng mạnh_mẽ cpu intel core i7 - 12700h cân tác vụ từ_học_tập giải_trí  tốc_độ xử_lý nhanh_chóng đa_nhiệm mượt_mà bộ_nhớ ram 16gb siêu , có_thể nâng_cấp tối_đa 32gb ổ_cứng 512gb rộng_rãi thiết_kế bắt_mắt màn_hình 16 inches thoải_mái , sắc nét hạt độ phân_giải wqxga 165hz trải nghiệm như_mơ chế_độ high gaming performance giúp hiệu game , lưu_loát di_chuyển bàn_phím tích_hợp đèn rgb 4 - trở_ngại làm_việc không_gian tối âm_thanh độ nét công_nghệ âm_thanh nahimic bữa tiệc thị_giác chân_thật máy đi kèm windows 11 home bản_quyền "
Gaming,""" chip i5 - 11400h card đồ_họa rời geforce rtx 3050 , trải nghiệm tựa game aaa hàng_đầu xử_lý tác vụ đồ_hoạ nặng_nề ram 8gb + 1 khe trống , nâng_cấp tối_đa 32gb ổ_cứng ssd không_gian lưu_trữ 512gb đa_nhiệm , thoải_mái ứng_dụng màn_hình 156 inches full hd độ phủ màu srgb 625 % , chất_lượng hiển_thị rõ_ràng hình_ảnh sắc nét  tích_hợp hd 720p phép đàm_thoại thông_qua video thoải_mái đa_dạng cổng giao_tiếp , dễ_dàng sử_dụng bàn_phím tích_hợp đèn led rgb giúp thỏa_sức làm_việc môi_trường thiếu_sáng vỏ nhựa cứng_cáp , trọng_lượng máy 230 kg cảm_giác cầm_chắc_tay máy đi kèm windows 11 home bản_quyền "" "
Van phong,"chip intel core i5 - 12450h , card đồ_họa intel uhd graphics thích_hợp văn_phòng tác vụ load file báo_cáo , exel hàng nghìn dòng  ram 8gb ổ_cứng ssd 512gb thời_gian load ứng_dụng , lưu_trữ thoải_mái  kích_thước màn_hình rộng , 16 inch đáp_ứng giải_trí , phim cực_kỳ thỏa_mãn , độ 300 nits , sử_dụng thoải_mái ngoài_trời lo_lắng lóa  trọng_lượng 17 kg có_thể đi di_chuyển dễ_dàng  máy đi kèm windows 11 bản_quyền  "
Van phong,""" chip i5 - 1135g7 kết_hợp card đồ_họa rời intel iris xe graphics hỗ_trợ tác vụ văn_phòng chỉnh_sửa ảnh cơ_bản pts , ,  ram 16gb ổ_cứng 512gb ssd , có_thể nâng_cấp tối_đa 1tb đem không_gian lưu_trữ rộng_rãi tốc_độ xử_lý , đa_nhiệm mượt_mà màn_hình 14 inches tích_hợp công_nghệ acer comfyview độ phân_giải full hd độ phân_giải hình_ảnh nét , mượt_mà khả_năng chống chói bảo_vệ mắt tích_hợp web cam hd 720p phép đàm_thoại thông_qua video thoải_mái bàn_phím tích_hợp đèn giúp thỏa_sức làm_việc môi_trường thiếu_sáng trang_bị cảm_biến vân - khoá máy 1 chạm máy đi kèm windows 11 home bản_quyền "" "
Gaming,"trang_bị cpu i7 12700h giúp thỏa_thích chiến tựa game màn_hình 156 inch full hd tần_số quét 165hz giúp thoải_mái tận_hưởng đồ_họa_game ram 16gb ổ_cứng ssd 512gb giúp lưu_trữ_lượng dữ_liệu tab hệ_thống cổng kết_nối dồi_dào , hỗ_trợ tối_đa kết_nối thiết_bị "
Sinh vien,"chip intel core i5 - 3320m xử_lý ổn thỏa_những tác vụng văn_phòng ram 4gb ssd 120gb ổn thỏa 10 tab lo giật lag màn_hình 14 inch hd xuất hình_ảnh chân_thật , đẹp_mắt trang_bị cổng kết_nối truyền xuất dữ_liệu nhanh_chóng "
Gaming,"màn_hình 156 inch , tần_số quét 144hz - trải nghiệm chiến game mượt_mà card đồ_hoạ rtx 3070 - tựa game aaa 512gb ssd + 1 khe - ssd khả_năng lưu_trữ , động ứng_dụng bàn_phím trang_bị led rgb sống_động "
Gaming,"thu_hút lớp vỏ màu xám sang_trọng , hiện_đại màn_hình 16 inch wqxga phép hiển_thị thước phim cực_chất cpu intel core i5 - 13500h giải_quyết yêu_cầu tựa game hot lol , pubg , gta ,  gpu nvidia geforce rtx 4050 đáp_ứng tựa game cấu_hình bàn_phím rgb 4 rực_rỡ , kết_cấu keycap đặc_trưng ôm trọn đầu ngón gõ máy "
Van phong,"laptop ngoại_hình mảnh_mai ấn_tượng , thu_hút ánh sức_mạnh xử_lý mạnh_mẽ , cân tác vụ - chip intel core i5 - 1135g7 , ram 8gb màn_hình 133 inch full hd sắc nét trải nghiệm hình_ảnh sống_động đa cổng kết_nối nhanh_chóng linh_hoạt , thoải_mái truyền dữ_liệu hoạt_động bền_bỉ viên pin dung_tích khủng 2 cell 30w "
Gaming,"sở_hữu thiết_kế sang_trọng gam màu xám tinh_tế , dễ_dàng thu_hút cân tác vụ học_tập cpu intel core i5 - 13420h card màn_hình nvidia geforce rtx 4050 hỗ_trợ tối_đa game , chỉnh_sửa hình_ảnh bộ_nhớ ssd 512 gb phép lưu_trữ dữ_liệu sao_chép màn_hình 155 inch công_nghệ chống chói giúp giây_phút tận_hưởng hình_ảnh sắc nét "
Van phong,"sở_hữu thiết_kế thời_thượng lớp vỏ hồng cá_tính cpu intel core i5 - 1235u mạnh_mẽ cân tác vụ học_tập , văn_phòng ram 8gb chuẩn ddr4 hỗ_trợ duyệt web nhanh_chóng lo lag , giật ổ_cứng 512 gb rộng_rãi giúp lưu_trữ tệp , tài_liệu màn_hình 141 inch full hd hỗ_trợ hiển_thị sắc nét , màu_sắc chân_thực "
Van phong,"sở_hữu thiết_kế máu xám sang_trọng , trọng_lượng giúp dễ_dàng trang_bị chip i5 thế_hệ 12 giúp giải_quyết công_việc văn_phòng game nhẹ ram 8gb ổ_cứng ssd 512 phép tab làm_việc lo giật lag màn_hình 156 inch tần_số quét 120hz giúp thước phim hình_ảnh sống_động "
Van phong,"sở_hữu thiết_kế sang_trọng , màu bạc bóng dễ_dàng thu_hút cpu r3 - 7320u giúp thực_hiện tác vụ văn_phòng một_cách tối_đa ram 8gb hỗ_trợ lướt web cực , tab lo giật lag ổ_cứng 256gb ssd giúp lưu_trữ không_gian cực trang_bị cảm_biến vân giúp có_thể máy_tính nhanh_chóng "
Gaming,"chiến game cực , ngại tựa game aaa nặng_nề rtx 3060 tần_số màn_hình 144hz trải nghiệm mướt căng nét điểm_ảnh thiết_kế chắc_tay , 22 kg cảm_giác chắc_chắn game lo_ngại làm_việc bóng_tối bàn_phím trang_bị đèn led sở_hữu hệ điều_hành windows 11 tân tiến cung_cấp giao_diện mới_mẻ "
Gaming,"màn_hình 156 inch full hd wva hỗ_trợ hình_ảnh sắc nét , mãn nhãn cpu adm r9 - 5900hx mạnh_mẽ , giúp giải_quyết nhanh_chóng tác vụ nhẹ ram 16gb giúp mở_hàng chục tab chrome lo lag , giật ổ_cứng khoang lưu_trữ rộng_rãi 1tb ssd giúp lưu file , hình_ảnh "
Gaming,"màn_hình 134 inch wqxga tần_số quét 165hz thời_gian phản_hồi 3ms khả_năng tái_tạo_hình_ảnh chân_thật , sống_động cpu amd ryzen 9 7940hs , gpu nvidia geforce rtx 4050 hỗ_trợ tự_do sáng_tạo , stream game mượt_mà ram 16gb ổ_cứng 1tb ssd hỗ_trợ lưu_trữ , máy , ứng_dụng gọn hỗ_trợ cảm_ứng khả_năng xoay gập 360 độ giúp thỏa_sức sáng_tạo "
Van phong,"amd ryzen 7 5800h - amd radeon graphics cấu_hình game đồ_họa đỉnh_cao , cân tựa game  ram 8gb , 512gb ssd tốc_độ xử_lý đa_nhiệm mượt_mà , trang giật , lag  công_nghệ màn_hình hiện_đại , tần_số quét 90hz , độ tối_đa 600 nit , công_nghệ chống ánh_sáng xanh sgs - bảo_vệ mắt tối_đa , hành ảnh hiển_thị sắc nét  cổng kết_nối đa_dạng - thuận_tiện  bàn_phím tích_hợp đèn led đơn_sắc - thỏa_sức làm_việc môi_trường thiếu_sáng thiết_kế vỏ kim_loại sang_trọng , 14 kg thuận_tiện di_chuyển ,  máy đi kèm windows 11 bản_quyền "
Sinh vien,"8gb ram , xử_lý ứng_dụng word , exel , pts giải_trí nhẹ_nhàng thiết_kế thanh_lịch - khum nhôm siêu mỏng nhẹ 13 kg , thuận_lợi đi học , làm_việc màn_hình hiển_thị sống_động - độ phân_giải full hd , tần_số quét 60hz làm_việc hiệu_quả - bàn_phím trang_bị đèn led "
Sinh vien,"thiết_kế mỏng nhẹ , trọng_lượng 119 kg giúp thuận_tiện đi học đi chip i7 - 1360p kết_hợp card đồ_họa intel iris xe graphics giúp thực_hiện công_việc văn_phòng giải_trí nhẹ_nhàng ram 16gb ổ_cứng 512gb + khe cắm giúp không_gian lưu_trữ dữ_liệu màn_hình 16 inch độ phân_giải wqxga độ phủ màu dci - p3 99 % đem chất_lượng hiển_thị hình_ảnh nét âm_thanh hd dolby atmos đem trải nghiệm âm_thanh sống_động , chân_thật "
Sinh vien,cpu amd ryzen 5 7530u hỗ_trợ xử_lý nhanh_chóng tác vụ văn_phòng 16gb ram ổ_cứng 512 gb ssd siêu_tốc hiệu_năng hoạt_động tuyệt_vời màn_hình ips 14 inch tốc_độ quét 60hz dễ_dàng thực_hiện thao_tác màn_hình một_cách mượt_mà trang_bị cổng kết_nối thông_dụng hỗ_trợ truyền_tải dữ_liệu nhanh_chóng 
Van phong,"sở_hữu thiết_kế cực mỏng nhẹ trọng_lượng 14 kg cpu intel core i5 - 1335u hỗ_trợ làm_việc , học_tập , giải_trí một_cách đơn_giản , trơn_tru chip đồ_họa intel iris xe graphics đáp_ứng nhu_cầu đồ_họa văn_phòng đơn_giản ram 8gb tốc_độ đa_nhiệm , giật lag chục tabs chrome ổ_cứng 512gb ssd dung_lượng lưu_trữ cực thoải_mái tải phần_mềm , tải phim màn_hình 14 inch full hd ips hỗ_trợ làm_việc , giải_trí cực nét "
Van phong,"sở_hữu kích_thước mỏng nhẹ trọng_lượng 879 g màn_hình pixelsense flow 13 inch 120hz hiển_thị rõ_ràng , chất_lượng dễ_dàng làm_việc giải_trí cpu intel core i5 - 1245u gen 12 cân tác vụ văn_phòng nhẹ card đồ_họa intel iris xe graphics dễ_dàng xử_lý thiết_kế hình_ảnh cơ_bản trang_bị 2 camera hỗ_trợ call video , làm_việc cực hỗ_trợ khóa khuôn_mặt giúp khóa nhanh_chóng "
Sinh vien,thiết_kế gọn màn_hình 14 inch trọng_lượng 14 kg cpu intel core i5 - 1335u hiệu_năng xử_lý công_việc nhanh_chóng ram 8gb đa_nhiệm hỗ_trợ tab trình_duyệt không_gian lưu_trữ thoải_mái 512gb ssd trang_bị đầy_đủ cổng kết_nối dễ_dàng truyền_tải dữ_liệu giây 
Van phong,màn_hình 14 inch oled 90 hz trải nghiệm sử_dụng mượt_mà cpu intel core i7 - 1360p mạnh_mẽ cân tác vụ văn_phòng mượt_mà ram 16 gb có_thể tab trình_duyệt lo giật treo máy ổ_cứng ssd 512 gb dung_lượng lưu_trữ tốc_độ truy_xuất khối_lượng mỏng nhẹ 139 kg dễ_dàng máy đi khắp_nơi 
Sinh vien,"sở_hữu thiết_kế cực mỏng nhẹ trọng_lượng 109 kg cpu intel core i7 10610u giải_quyết gọn tác vụ nhẹ ram 16gb ổ_cứng 512gb nhanh_chóng tải chạy đa_nhiệm ứng_dụng màn_hình 14 inch full hd hỗ_trợ làm_việc , giải_trí cực mãn nhãn trang_bị wifi 6 giúp kết_nối nhanh_chóng thiết_bị khởi_động "
Gaming,"laptop gaming màn_hình 156 inch trọng_lượng 225 kg nhẹ_nhàng game thủ di_chuyển cpu ryzen 5 - 5500h làm_việc chiến game máy xử_lý gọn card màn_hình rtx 2050 mạnh_mẽ giúp game thủ tận_hưởng hiệu_ứng đồ_họa mãn nhãn ram 8gb ssd 512gb nvme cực giúp lưu_trữ game , máy nhanh_chóng tần_số quét 144 hz hợp tựa game bắn súng fps csgo , overwatch 2 , giúp pha xử_lý chính_xác "
Sinh vien,"thoải_mái chiến game công_việc chip xử_lý core i5 kaby lake  không_gian lưu_trữ giới_hạn ổ_cứng hdd 1 tb  trải nghiệm âm_thanh công_nghệ xử_lý độc_quyền_maxxaudio đa_dạng cổng kết_nối usb 30 , hdmi , lan ( rj45 ) , vga ( d - sub )  thiết_kế gọn_nhẹ sang_trọng vỏ nắp máy kim_loại "
Van phong,"cpu i5 - 1235u hiệu_năng cực_kỳ ổn_định sử_dụng học_tập văn_phòng ram 8gb chuẩn ddr4 có_thể đa_nhiệm phần_mềm không_gian ổ_cứng siêu thoải_mái giúp lưu_trữ tệp tài_liệu ssd 512gb chất_lượng hiển_thị hình_ảnh nét , màu_sắc chân_thực màn_hình 14 inch , 45 % ntsc "
Van phong,"sở_hữu thiết_kế tinh_tế màn_hình 156 inch full hd rộng_rãi , sắc nét cpu amd ryzen r7 - 5700u phục_vụ nhu_cầu làm_việc , phim , giải_trí ,  dung_lượng ram 16gb đa_nhiệm hỗ_trợ lướt web hàng chục tabs lo lag , giật trang_bị ổ_cứng 1tb ssd giúp lưu_trữ file , tài_liệu , phim_ảnh thoải_mái hệ điều_hành windows 11 nâng_cấp trải nghiệm giao_diện "
Gaming,"amd ryzen 5 5600h , rtx 3050 ti 4gb - chiến mượt tựa game aaa màn_hình 165hz , đồ phủ màu 100 % srgb - trải nghiệm hình_ảnh mượt_mà rực_rỡ bao_giờ bàn_phím led rgb sống_động rực_rỡ 8gb ram , trống 1 khe phép nâng_cấp tối_đa 16gb tản_nhiệt mạnh_mẽ , lo hiệu_năng quá_trình game "
Van phong,"sở_hữu lớp vỏ kim_loại_màu vàng sang_trọng cực_kỳ thu_hút ánh màn_hình 14 inch full hd giúp tái_tạo_hình_ảnh màu_sắc tươi_tắn độ chi_tiết cpu intel core i5 1335u đáp_ứng mượt_mà tác vụ word , excel ,  hỗ_trợ gập 360 độ kết_hợp màn_hình cảm_ứng đa thao_tác đa_dạng linh_hoạt bảo_mật vân giúp khóa chạm vô_cùng tiện_lợi "
Sinh vien,"thoải_mái lưu_trữ - 256gb ssd + 1 khe hdd trống phép nâng_cấp 4gb onboard + 4gb khe khả_năng nâng_cấp tối_đa 12gb thoả sức giải_trí phim edit hình_ảnh - màn_hình full hd , kích_thước 156 inch game nhẹ_nhàng card đồ_hoạ intel ® iris ® xe_graphics "
Van phong,sở_hữu thiết_kế vô_cùng mỏng nhẹ trọng_lượng 879g dễ_dàng đi bất_cứ làm_việc cpu intel core i7 - 1255u cân tác vụ văn_phòng nhẹ ram 16gb đa_nhiệm lo trình_duyệt tab công_việc load ổ_cứng 256gb có_thể tháo lắp cực tiện_lợi nâng_cấp màn_hình cảm_ứng 13 inch cực mướt hỗ_trợ thao_tác vuốt chạm dễ_dàng 
Sinh vien,"chip i7 - 1360p kết_hợp card đồ_họa intel iris xe graphics đáp_ứng công_việc văn_phòng , chỉnh_sửa hình_ảnh nhẹ ram 16gb ổ_cứng 1tb ssd phép máy lưu_trữ dữ_liệu hoạt_động mượt_mà màn_hình 17 inch độ phủ màu dci - p3 99 % phép thước phim , hỉnh ảnh sống_động chân_thật thiết_kế kiểu_dáng sang_trọng , gọn , trọng_lượng 1350 kg , thích_hợp "
Sinh vien,"chip intel core i5 1235u sức_mạnh vượt_trội , mượt_mà học_tập giải_trí tác vụ đồ_họa xử_lý hiệu_quả gpu intel iris xe khả_năng xuất hình 8k ram 8gb ddr4 3200 mhz ssd 256 gb không_gian đa_nhiệm thoải_mái , tốc_độ nhanh_chóng kích_thước màn_hình 15,6 inch , viền mỏng micro - edge , trải nghiệm tràn viền hấp_dẫn kiểu_dáng thanh_mảnh , dễ_dàng đi bất_cứ trọng_lượng 1,69 kg độ mỏng 1,79 cm vi xử_lý tiết_kiệm năng_lượng viên pin 3 cell 41wh giúp thời_lượng pin 9 máy đi kèm windows 11 "
Van phong,"thiết_kế gọn_nhẹ 14 kg cơ_động sẵn_sàng đi khắp_nơi cpu intel core i5 - 1235u giải_quyết gọn tác vụ văn_phòng ram 16gb kết_hợp ổ_cứng 512gb ssd hiệu_suất nhanh_chóng , lưu_trữ thoải_mái màn_hình 14 inch full hd ips khả_năng hiển_thị sắc nét "
Sinh vien,"thiết_kế laptop mỏng nhẹ , trọng_lượng 14 kg thích_hợp cất balo cpu ryzen 5 7530u đáp_ứng đầy_đủ nhu_cầu văn_phòng học_tập card đồ_họa amd radeon graphics đem hình_ảnh sắc nét , video chân_thật ram 8gb kết_hợp cứng 512gb thỏa_thích lưu_trữ file , dữ_liệu "
Van phong,"sở_hữu hữu thiết_kế tối_giản tone màu bạc sang_trọng , trọng_lượng gọn_nhẹ 141 kg dễ_dàng meo khắp  màn_hình 14 inch ips khả_năng tái_tạo màu_sắc chân_thực sống_động , độ chính_xác màu góc siêu rộng 178 độ  cpu intel core i5 - 1235u mạnh_mẽ , xử_lý đa_nhiệm tác vụ văn_phòng word , excel , powerpoint ,  kết_hợp card đồ_họa intel iris xe graphics khả_năng chỉnh_sửa hình_ảnh cơ_bản giải_trí , phim một_cách trơn_tru  8gb ram ổ_cứng ssd 512gb nvme pcie không_gian lưu_trữ rộng_lớn , tăng_tốc_độ khởi_động máy , ứng_dụng nhanh_chóng  camera độ phân_giải 720p hỗ_trợ call video , họp trực_tuyến học online chất_lượng "
Gaming,"cấu_hình game đồ_họa đỉnh_cao , cân tựa game - intel core i7 - 12700h card rời rtx ™ 3050ti  ram 8gb + 1 khe trống phép nâng_cấp tối_đa 32gb , ổ_cứng ssd 512gb tốc_độ xử_lý đa_nhiệm mượt_mà  màn_hình full hd kích_thước chuẩn 156 inch , tần_số quét 144hz hình_ảnh sắc nét  tích_hợp webcam 720p phép đàm_thoại thông_qua video thoải_mái  thiết_kế vỏ nhựa cứng_cáp , 22 kg cảm_giác cầm_chắc_tay  năng_lượng bất_tận viên pin 4 - cell , 57whr  máy đi kèm windows 11 bản_quyền  "
Sinh vien,"sở_hữu kiểu_dáng lịch_lãm chi_tiết tiết hoàn_thiện vô_cùng chỉn_chu màn_hình ips 14 inch độ phân_giải full hd chất_lượng hình_ảnh sắc nét , sống_động cpu intel core i5 - 10310u mạnh_mẽ , giải_quyết nhanh_chóng tác vụ ram 8gb 256gb ssd tốc_độ máy , lưu_trữ file nhanh_chóng hỗ_trợ intel wi - fi 6 giúp kết_nối máy ổn_định họp , học online "
Van phong,"chip core i5 - 1135g7 card intel iris xe graphics - thoả sức học_tập , làm_việc giải_trí tựa game nhẹ ổ_cứng 512gb ssd , tốc_độ khởi_động nhanh_chóng , khả_năng lưu_trữ vượt_trội màn_hình full hd kích_thước 133 inch chất_lượng hiển_thị sắc nét  năng_lượng bất_tận viên pin 4 cell 67whr  tích_hợp webcam 720p hd phép đàm_thoại thông_qua video thoải_mái  thiết_kế vỏ kim_loại sang_trọng , 114 kg thuận_tiện di_chuyển ,  máy đi kèm windows 11 bản_quyền "
Sinh vien,"sở_hữu thiết_kế mỏng nhẹ trọng_lượng 133 kg màn_hình 14 inch full hd sắc nét , hình_ảnh sinh_động cpu intel core i7 - 1165g7 mạnh_mẽ đáp_ứng nhu_cầu học_tập , làm_việc dung_lượng 512 gb không_gian lưu_trữ , lưu tài_liệu , file nhanh_chóng trang_bị đầy_đủ cổng kết_nối thông_dụng dễ_dàng kết_nối , truyền_tải dữ_liệu "
Van phong,"sở_hữu màu bạc sang_trọng thiết_kế vuông_vắn tinh_tế , trọng_lượng nhẹ 17 kg dễ_dàng balo vác đi bất_cứ  cpu amd ryzen 7 5800h giải_quyết tác vụ văn_phòng cơ_bản nâng thỏa_sức sáng_tạo , đồ_họa cơ_bản máy vga amd radeon graphics  8gb ram ddr4 xử_lý đa_nhiệm nhanh_chóng thao_tác mượt_mà lưu_trữ 512gb thỏa_sức lưu_trữ dữ_liệu quan_trọng  bản_lề vô_cùng chắc_chắn có_thể gập 180 dễ_dàng chia_sẻ thông_tin  máy trang_bị bảo_mật vân , giúp bảo_mật thông_tin , máy nhanh_chóng 1 chạm "
Van phong,"laptop phù_hợp nhân_viên văn_phòng tân_sinh_viên thiết_kế tối_giản mang_vẻ đẹp tinh_tế sản_phẩm cơ_động khối_lượng 163 kg dễ_dàng học_tập làm_việc  vi xử_lý intel core i3 - 1215u card đồ_họa intel uhd giúp tiết_kiệm điện_năng khả_năng xử_lý nhanh_chóng tác vụ hàng  ram 8gb khả_năng đa_nhiệm ấn_tượng , xử_lý tác vụ gián_đoạn tình_trạng giật lag  ổ_cứng ssd 512gb khả_năng lưu_trữ rộng_lớn , rút ngắn thời_gian khởi_động máy truy_cập dữ_liệu , phần_mềm  màn_hình 156 inch tn khung hình sắc nét màu_sắc sống_động trải nghiệm hình_ảnh tuyệt_vời "
Gaming,"giải_quyết hoàn_hảo tựa game aaa hoàn_thành_công_việc cpu i7 - 13650hx thế_hệ 13 hoàn_toàn chiếu alienfx có_thể lập_trình tối_đa 16,8 triệu màu riêng_biệt card đồ_hoạ nvidia geforce rtx 4050 trải nghiệm game hoàn_mỹ , giật lag dựng_phim , game render hình_ảnh 3d trơn_tru ram 16gb ddr5 ổ_cứng ssd 512gb trang_bị công_nghệ chống bóng_ma đèn led rgb đèn alienfx đa sắc_màu bàn_phím "
Van phong,"chip core i5 - 1240p tiết_kiệm pin , hiệu_năng ổn_định thích_hợp văn_phòng , học_tập dung_lượng 16gb , ổ_cứng 512gb ssd tốc_độ xử_lý đa_nhiệm mượt_mà , trang giật , lag  màn_hình oled 28 k , tỷ_lệ 16 : 10 , thời_gian phản_hồi 02 ms , tần_số quét 90hz , hạn_chế ánh_sáng xanh hiển_thị sắc nét , rõ_ràng điều_kiện  bàn_phím tích_hợp đèn - thỏa_sức làm_việc môi_trường thiếu_sáng trang_bị cảm_biến vân - khóa máy 1 chạm  năng_lượng bất_tận viên pin 75whrs , 2s2p , 4 - cell li - ion  thiết_kế vỏ kim_loại sang_trọng , 139 kg thuận_tiện di_chuyển ,  máy đi kèm windows 11 bản_quyền "
Sinh vien,"màn_hình 14 inch độ phân_giải wuxga chất_lượng hình_ảnh sắc nét góc rộng card tích_hợp intel iris xe hỗ_trợ thiết_kế đồ_họa cơ_bản chiến game đơn_giản mượt_mà bộ_nhớ ram 16 gb chuẩn lpddr5 đáp_ứng nhu_cầu làm_việc hiệu_năng ổ_cứng ssd 512 gb nvme pcie tốc_độ đọc ghi nhanh_chóng không_gian lưu_trữ ổn_định màn_hình cảm_ứng thể_thao_tác trực_tiếp màn_hình chuột , bàn_phím "
