Nhãn,Features
Gaming,"màn_hình 16 inch wqxga tần_số quét 165hz cực mượt_mà tự_tin game cpu amd ryzen 7 7840hs xử_lý tác vụ , game công_việc đòi_hỏi hiệu_suất gpu rtx 4060 giúp hình_ảnh đẹp chân_thực , trải nghiệm đồ_họa đỉnh_cao dung_lượng ram 16gb giúp làm_việc đa_nhiệm mượt_mà game giật lag ổ_cứng 512 gb ssd giúp giảm_thiểu thời_gian khởi_động hệ điều_hành tải_game "
Sinh vien,"thiết_kế tối_ưu di_động trọng_lượng nhẹ_nhàng 137 kg cpu intel core i5 - 12450h mạnh_mẽ , xử_lý tác vụ văn_phòng đơn_giản công_việc thiết_kế hình_ảnh 16gb ram đa_nhiệm giúp làm_việc ứng_dụng lo_lắng giật lag ổ_cứng ssd 512gb không_gian lưu_trữ giúp khởi_động máy tệp thư_mục nhanh_chóng màn_hình 14 inch full hd đảm_bảo hiển_thị hình_ảnh độ sắc nét chi_tiết "
Sinh vien,"ngoại_hình bắt_mắt tông màu bạc sang_trọng , khung máy chế tác kim_loại intel core i7 1260p card intel uhd graphics mạnh_mẽ , hiệu_suất khả_năng xử_lý đa_nhiệm ram 16 gb ddr5 khả_năng mờ nhều tab lo giật lag ssd 512gb không_gian rộng_lớn lưu_trữ video , tài_liệu yêu_thích kích_thước 14 inch độ phân_giải wuxga chất_lượng hình_ảnh sắc nét , chân_thật "
Gaming,"chip amd ryzen 7 5800h card rời rtx 3050 , thoả sức trải nghiệm game aaa đồ_hoạ ram 8gb + 1 khe trống phép nâng_cấp tối_đa 32gb , load game nhanh_chóng màn_hình full hd kích_thước chuẩn 156 inch , tần_số quét 120hz , ips khả_năng hiển_thị sắc nét , màu_sắc chân_thật khả_năng tái_tạo chuẩn_xác  đa_dạng cổng kết_nối cổng hdmi 14 , cổng usb c , truyền xuất dữ_liệu thiết_bị  năng_lượng bất_tận viên pin 4 cells , 56whrs  trọng_lượng 25 kg - cảm_giác cầm_chắc_tay  máy đi kèm windows 11 bản_quyền "
Van phong,"sở_hữu màn_hình 156 inch lớp vỏ bạc thời_thượng cpu intel core i5 1340p hỗ_trợ giải_quyết gọn hàng_loạt tác vụ văn_phòng word , excel ,  card intel iris xe graphics giúp giải_quyết khối_lượng công_việc ram 16gb ổ_cứng 512 gb ssd ch không_gian lưu_trữ , lưu_trữ tài_liệu , hình_ảnh ,  độ bền chuẩn quân_đội mil std 810h gia_tăng tuổi_thọ độ bền_bỉ máy "
Van phong,"chip intel core i5 - 1135g7 xung_nhịp tối_đa 42 ghz , lướt web làm_việc văn_phòng mượt_mà ổ_cứng ssd 512gb - tốc_độ khởi_động máy cực màn_hình full hd kích_thước 133 inch , tần_số quét 60hz chất_lượng hiển_thị sắc nét  tích_hợp webcam 720p hd phép đàm_thoại thông_qua video thoải_mái  thiết_kế mỏng nhẹ - 1,3 kg , đồng_hành khắp  máy đi kèm windows 10 bản_quyền "
Van phong,"cpu intel core i5 1235u xử_lý mượt_mà tác vụ thường_ngày lướt web , soạn_thảo săn , phim , giải_trí ,  ram 8 gb sử_dụng tác vụ học_tập , làm_việc văn_phòng ổ_cứng ssd 512 gb tốc_độ đọc , ghi , rút ngắn đáng_kể thời_gian phản_hồi màn_hình 156 inch full hd góc rộng_lớn chất_lượng hình_ảnh hiển_thị nét , trung_thực hỗ_trợ đầy_đủ cổng giao_tiếp : usb 32 , hdmi , jack tai_nghe 35 mm , lan ( rj45 ) , hỗ_trợ kết_nối thuận_tiện "
Gaming,"chip amd ryzen 5 - 7535hs xử_lý nhanh_chóng tác vụ văn_phòng , đồ_hoạ , coding chiến_game gpu amd radeon rx 6550m 4 gb đồ_hoạ , mượt_mà ổn_định pha giao_tranh ram 16 gb phép máy vận_hành mượt_mà , tác vụ ổ_cứng 512 gb hỗ_trợ khởi_động laptop , truy_xuất dữ_liệu tần_số quét 144 hz giúp hình_ảnh rách nhoè mờ game "
Van phong,"thiêt kế thời_thượng , 14 kg - dễ_dàng khoá vân 1 chạm - giúp máy nhanh_chóng trò_chuyện thông_qua video call webcam 720p tích_hợp xử_lý mượt_mà tác vụ văn_phòng , học_tập - 8gb ram , chip core i5 - 1135g7 "
Van phong,"512gb ssd + 1 khe hdd sata - khởi_động 4gb ram onboard + 1 khe 4gb - khả_năng nâng_cấp tối_đa 12gb màn_hình full hd , chống chói - tầm rộng , hiển_thị rõ_ràng thiết_kế trẻ_trung năng_động - vỏ nhựa hạn_chế bám dấu vân "
Van phong,"màn_hình 156 inch full hd ips chất_lượng hình chính_xác sống_động cảm_biến vân tích_hợp chạm máy_tính cpu amd ryzen r7 - 5700u tác vụ văn_phòng , học_tập giải_quyết nốt_nhạc ram 8gb chuẩn ddr4 hỗ_trợ mở_hàng chục tabs duyệt web lo lag , giật ổ_cứng 512gb ssd không_gian lưu_trữ rộng_rãi , thoải_mái "
Van phong,"sở_hữu thiết_kế sang_trọng gam màu bạc tinh_tế màn_hình oled 14 inch wqxga trải nghiệm hình_ảnh cực sắc nét cpu amd ryzen 5 7530u mạnh_mẽ cân tác vụ nhẹ ram 8gb kết_hợp ổ_cứng 512 gb ssd tốc_độ máy , ứng_dụng nhanh_chóng máy tích_hợp bảo_mật vân giúp máy tích_tắc "
Sinh vien,"màn_hình 14 inch full hd hình_ảnh sắc nét , màu_sắc chân_thực cpu intel core i5 - 1155g7 giải_quyết tác vụ office word , excel , powerpoint ,  ram 16 gb hỗ_trợ mượt_mà 10 tab chrome trang_bị đầy_đủ cổng kết_nối usb 32 , hdmi , usb 20 , usb type - c , giúp dễ_dàng kết_nối thiết_bị tương_thích thiết_kế thanh_lịch , tao_nhã cân nhẹ vỏn_vẹn 141 kg "
Sinh vien,"sở_hữu màn_hình 14 inch full hd , độ 300nits dễ_dàng làm_việc cpu intel core i7 - 1165g7 giải_quyết tác vụ văn_phòng , học_tập dung_lượng ram 16 gb hỗ_trợ mượt_mà 10 tab chrome ổ_cứng 512gb ssd rộng_rãi , hỗ_trợ lưu tài_liệu , lưu phim , ảnh thoải_mái thiết_kế thanh_lịch , tao_nhã cân nhẹ vỏn_vẹn 141 kg "
Sinh vien,"trang_bị chip intel core i5 - 6200u card intel hd graphics xử_lý ổn thỏa tác vụ văn_phòng ram 8gb ssd 240gb ổn thỏa_nhiều tab lo giật lag màn_hình 125 inch full hd giúp hình_ảnh , video một_cách ổn thỏa trọng_lượng laptop mỏng nhẹ 118 kg giúp thoải_mái "
Van phong,"sở_hữu cpu md ryzen 5 - 5625u giúp giải_quyết ổn thỏa tác vụ văn_phòng màn_hình 14 inch độ phân_giải full hd phép hiển_thị hình_ảnh đặc_sắc , chân_thật ổ_cứng ssd 512gb ram 8gb thỏa_thích tab khởi_động máy_tính , ứng_dụng màn_hình gập kèm tính_năng cảm_ứng giúp dễ_dàng sử_dụng , dễ_dàng phim yêu_thích  "
Gaming,"hiệu_năng siêu , bộ_nhớ dữ_liệu - chip intel core i5 - 11400h , bộ_nhớ 512gb ssd trải nghiệm hình_ảnh chất_lượng - màn_hình 156 "" , full hd , tần_số quét 144hz card đồ_hoạ rời nvidia ® geforce gtx ™ 1650 hình_ảnh mượt_mà giật lag năng_lượng bất_tận lắng lo viên pin 57wh "
Sinh vien,"thiết_kế đơn_giản , cá_tính , trẻ_trung tone màu đen bao_phủ màn_hình 14 inch full hd trải nghiệm hình_ảnh vô_cùng sắc nét cpu intel core i3 - 1115g4 8gb ram ddr4 xử_lý mượt tác vụ văn_phòng : word , excel ,  card đồ_họa intel uhd graphics hỗ_trợ chỉnh ảnh , dựng video đơn_giản không_gian lưu_trữ rộng_rãi ổ_cứng 512gb ssd "
Sinh vien,"i5 1235u - xử_lý tác vụ văn_phòng 8gb ram khả_năng xử_lý đa_nhiệm , có_thể tháo nâng_cấp card đồ_hoạ mx550 - chỉnh_sửa ảnh pts giải_trí nhẹ_nhàng tựa game màn_hình 156 inch thoả sức làm_việc giải_trí "
Sinh vien,"chip intel core i3 1215u vận_hành nhanh_chóng tác vụ văn_phòng , doanh_nghiệp word , excel ,  card intel uhd graphics dễ_dàng tinh_chỉnh_hình_ảnh , video cơ_bản một_số tựa game nhẹ ram 8 gb đa_nhiệm hiệu_quả , tab chrome lo giật lag ổ_cứng ssd 512 gb phép tải tài_liệu , hình_ảnh video "
Sinh vien,"intel core intel ® core ™ i3 - 1115g4 - xử_lý mượt_mà tác vụ văng phòng hằng bàn_phím fullsize , độ nảy - trải nghiệm gõ văn_bản kết_nối bluetooth 50 phép kết_nối thiết_bị dây màn_hình kích_thước 14 inch ips góc rộng "
Sinh vien,"laptop học_tập - văn_phòng cực mỏng nhẹ trọng_lượng 13 kg cpu intel core i7 - 1195g7 cân tác vụ văn_phòng : word , excel , powerpoint ,  card đồ_họa intel iris xe graphics thoải_mái chạy ứng_dụng văn_phòng cơ_bản phần_mềm thiết_kế đơn_giản ram 8 gb chuẩn ddr4 giúp thao_tác đa_nhiệm mượt khởi_động máy , ứng_dụng nhanh_chóng giây ổ_cứng ssd 512 gb pcie nvme độ phủ màu 45 % ntsc , 63 % srgb hỗ_trợ thiết_kế , làm_việc màu_sắc chuẩn_xác "
Van phong,"thiết_kế sang_trọng - vỏ kim_loại chắc_chắn , 1,4 kg 8gb ram onboard - đa_nhiệm , phép ứng_dụng thoải_mái lưu_trữ tài_liệu , khởi_động nhanh_chóng - 512gb ssd card đồ_hoạ amd radeon - chỉnh_sửa ảnh pts giải_trí tựa game nhẹ_nhàng "
Van phong,"sở_hữu thiết_kế sang_trọng , mỏng nhẹ trọng_lượng 999gram màn_hình 14 inch wuxga cực sắc nét cpu intel core i5 - 1340p mạnh_mẽ cân tác vụ văn_phòng ram 8gb đi ổ_cứng 256gb ssd phép lưu_trữ file , tài_liệu hỗ_trợ khóa khuôn_mặt giúp máy tích_tắc "
Sinh vien,"sở_hữu thiết_kế sang_trọng lớp vỏ màu vàng gold tinh_tế , kích_thước máy gọn_nhẹ 175 kg dễ_dàng balo  màn_hình 156 inch độ phân_giải full hd chất_lượng hình_ảnh sắc nét , độ 250 nits , độ phù màu 45 % ntsc hiển_thị màu_sắc  cpu intel core i5 - 1235u card đồ_họa mx550 xử_lý đa tác vụ máy , phép sử_dụng ứng_dụng một_cách mượt_mà  ram 8gb kết_hợp ổ_cứng ssd 256gb pcie nvme không_gian lưu_trữ rộng_rãi , đồng_thời đẩy tốc_độ truy_xuất dữ_liệu , giúp máy khởi_động ứng_dụng một_cách nhanh_chóng  dọc hai máy cổng kết_nối thông_dụng : usb type - a , usb type - c , hdmi , giúp kết_nối dễ_dàng thiết_bị ngoại_vi  wi - fi 80211 ax bluetooth 52 hiện_đại đảm_bảo kết_nối trực_tuyến ổn_định , mượt_mà "
Gaming,"thiết_kế gam màu đen sang_trọng , tế , dễ_dàng thu_hút ánh cpu r7 - 5800h xử_lý tác vụ văn_phòng game thoải_mái màn_hình 156 inch tần_số quét 144hz phép trải nghiệm mượt_mà hình_ảnh game ram 16gb giúp sử tab lo lag máy ổ_cứng 512gb ssd phép lưu_trữ dữ_liệu "
Van phong,"sở_hữu thiết_kế thời_thượng đường_nét thiết_kế mềm_mại , sang_trọng màn_hình 133 inch full hd khung hình sắc nét , sống_động cpu intel core i5 - 1235u khả_năng vận_hành xử_lý nhanh_chóng , mượt_mà chất_lượng đồ_họa đỉnh_cao chip đồ_họa intel iris xe_graphics ram 8gb chuẩn ddr4 khả_năng đa_nhiệm thao_tác tác vụ lo lag , giật "
Van phong,"chip intel core i5 - 1240p , card đồ_họa intel iris xe graphics thích_hợp văn_phòng tác vụ load file báo_cáo , excel hàng nghìn_dòng ram 8gb đa_nhiệm thao_tác mượt_mà , tab lo lag , giật kết_nối giới_hạn , trò_chuyện video call camera hp wide vision 720p hd trọng_lượng 175 kg có_thể đi di_chuyển dễ_dàng máy đi kèm windows 11 home bản_quyền "
Sinh vien,"sở_hữu thiết_kế gọn_nhẹ tông màu bạc sang_trọng , chắc_hẳn sản_phẩm yêu_thích màn_hình 14 inch đi kèm độ phủ màu 100 % dci - p3 chắc_hẳn đem trải nghiệm tuyệt_vời hình_ảnh , video trang_bị cpu intel core i5 - 13500h giúp xử_lý tác vụ văn_phòng , giải_trí chỉnh_sửa hình_ảnh nhẹ pts ổ_cứng ssd 512gb giúp không_gian lưu_trữ dữ_liệu rộng_lớn "
Sinh vien,"sở_hữu thiết_kế tinh_tế tone màu xám đẹp_mắt giải_quyết tác vụ học_tập , văn_phòng cpu intel core i3 - 1215u màn_hình cảm_ứng 14 inch 22 k cực sắc nét hỗ_trợ học_tập , làm_việc , thao_tác nhanh_chóng ram 8gb ổ_cứng 512gb rộng_rãi hỗ_trợ lưu_trữ file , tài_liệu học_tập trang_bị đầy_đủ cổng kết_nối giúp truyền_tải dữ_liệu nhanh_chóng "
Gaming,"cấu_hình game đồ_họa đỉnh_cao , cân tựa game - i5 - 12500h card rời rtx 3050 khả_năng chỉnh_sửa hình_ảnh pts , render video ngắn mượt_mà  ổ_cứng ssd 512gb tốc_độ xử_lý đa_nhiệm mượt_mà , trang giật , lag  kích_thước chuẩn 156 inch , độ phân_giải full hd , ips , tần_số quét 165hz trải nghiệm hình_ảnh chân_thật , sắc nét  tích_hợp webcam 1080p phép đàm_thoại thông_qua video thoải_mái  bàn_phím tích_hợp đèn 4 - zone rgb backlit - thỏa_sức làm_việc môi_trường thiếu_sáng năng_lượng bất_tận viên pin 3 cell , 80wh  trọng_lượng 235 kg cảm_giác cầm_chắc_tay  máy đi kèm windows 11 bản_quyền "
Sinh vien,"may thiết_kế mỏng , trọng_lượng nhẹ 113 kg giúp cảm_giác quá_trình di_chuyển màn_hình 14 inch phù_hợp nhu_cầu làm_việc giải_trí cpu i7 8550u mạnh_mẽ , thích_hợp giải_quyết tác vụ văn_phòng ram 256gb kết_hợp ổ_cứng ssd giúp tab một_cách nhanh_chóng lag máy "
Gaming,""" - chip i7 - 1185g7 card đồ_họa rời gtx 1660 ti khả_năng chiến tựa game , chỉnh_sửa hình_ảnh pts , render video ngắn mượt_mà ram 16gb 1 khe cắm có_thể nâng_cấp tối_đa 32gb ổ_cứng ssd 512gb tốc_độ xử_lý đa_nhiệm mượt_mà màn_hình 156 inches tần_số 144hz dải màu 45 % ntsc trải nghiệm màu_sắc chân_thực tích_hợp web cam hd 720p phép đàm_thoại thông_qua video thoải_mái thiết_kế vỏ kim_loại chắc_chắn , 169 kg thuận_tiện di_chuyển , máy đi kèm windows 10 home bản_quyền "" "
Van phong,"chip intel core i3 - 1115g4 - cấu_hình ổn_định , phục_vụ tác vụ văn_phòng  8 gb ram ổ_cứng chuẩn ssd cung_cấp 128 gb lưu_trữ , phục_vụ nhu_cầu sử_dụng  màn_hình công_nghệ chống chói - làm_việc lo mỏi_mắt  đa_dạng cổng kết_nối : jack cắm audio , cổng hdmi 14 , cổng usb c , truyền xuất dữ_liệu thiết_bị  tích_hợp webcam 720p hd phép đàm_thoại thông_qua video thoải_mái  thiết_kế vỏ nhựa cứng_cáp , 183 kg thuận_tiện di_chuyển ,  máy đi kèm windows 10 bản_quyền "
Van phong,"sở_hữu thiết_kế sang_trọng tone màu xám lịch_lãm cân tác vụ học_tập , văn_phòng cpu intel core i7 - 1355u card intel iris xe graphics hỗ_trợ chỉnh_sửa ảnh cơ_bản , giải_trí tựa game nhẹ ram 16gb mở_hàng tục tabs chrome lo giật , lag ổ_cứng 512gb ssd giúp máy nhanh_chóng , không_gian lưu_trữ file , tài_liệu rộng_rãi "
Gaming,""" chip i5 - 10300h card đồ_họa rời geforce gtx 1650 edit video thoải_mái , chiến game hiệu_năng hàng_đầu ram 8gb , nâng_cấp tối_đa 32gb ổ_cứng ssd không_gian lưu_trữ 512gb thời_gian khởi_động load ứng_dụng nhanh_chóng màn_hình 156 inches độ phân_giải full hd , độ phủ màu srgb 625 % chất_lượng hiển_thị rõ_ràng đa_dạng cổng giao_tiếp , dễ_dàng sử_dụng bàn_phím tích_hợp đèn led rgb - sống_động trận_đấu vỏ nhựa cứng_cáp , trọng_lượng máy 230 kg cảm_giác cầm_chắc_tay máy đi kèm windows 11 home bản_quyền "" "
Gaming,"sở_hữu thiết_kế mỏng nhẹ , giúp cảm_giác cpu i5 - 12450h card đồ_họa rtx2050 giúp thỏa_thích trải nghiệm tựa game lo máy_lag ổ_cứng ssd 512gb ram 8gb giúp không_gian lưu_trữ laptop hoạt_động mượt_mà màn_hình 156 inch độ phủ màu 45 % ntsc đem trải nghiệm sắc nét game "
Gaming,"chip intel core i5 - 11400h card đồ_họa rời geforce rtx 3050 khả_năng chiến tựa game aaa độ phủ màu 100 % srgb màu_sắc chính_xác đồ_hoạ , chỉnh_sửa hình_ảnh ram 8gb + 1 khe , nâng_cấp tối_đa 32gb ổ_cứng ssd 512gb tốc_độ xử_lý mượt_mà , nhanh_chóng , lo giật lag màn_hình 156 inches ips độ phân_giải full hd tần_số 144hz trải nghiệm hình_ảnh , màu_sắc chân_thực , sinh_động đa_dạng cổng giao_tiếp , dễ_dàng sử_dụng máy đi kèm windows 11 sl bản_quyền "
Sinh vien,"sở_hữu cpu i7 1260p card đồ_họa intel iris xe giúp bạ xử_lý công_việc văn_phòng xử_lý ảnh nhẹ màn_hình 14 inch độ phân_giải wuxga giúp trải nghiệm hình_ảnh chân_thật , sắc nét ổ_cứng ssd dung_lượng 2tb , không_gian lưu_trữ rộng_lớn , copy dữ_liệu usb trang_bị cổng kết_nối giúp quá_trình xuất / nhập dữ_liệu trở_nên thuận_tiện thiết_kế mỏng nhẹ , sang_trọng , trọng_lượng 136 kg giúp khó_chịu "
Gaming,"cpu intel core i5 12450h card rời nvidia geforce rtx 4050 6 gb hiệu_năng mạnh_mẽ , thoải_mái chiến tựa game phổ_biến ram 8 gb ddr4 khả_năng đa_nhiệm game , xử_lý công_việc ứng_dụng lo giật lag ổ_cứng ssd 512 gb thỏa_sức tải tựa game hot , tệp_tin ứng_dụng màn_hình rộng 156 inch full hd không_gian hiển_thị rộng_lớn , hình_ảnh nét tần_số quét 144 hz giúp xé hình trễ ảnh , tận_hưởng giờ_phút game mượt_mà "
Van phong,"cpu intel core i5 - 12500h giúp xử_lý trơn_tru tác vụ văn_phòng , giải_trí đồ_họa thiết_kế hình_ảnh , video đơn_giản ram 8 gb mạnh_mẽ phép có_thể nhạc tab trình_duyệt web mượt_mà , giật lag ổ_cứng ssd 512 gb không_gian lưu_trữ , truy_xuất dữ_liệu màn_hình 156 inch oled chuẩn display hdr true black 600 hình_ảnh chất_lượng , màu_sắc rực_rỡ độ tương_phản_cao "
Van phong,"mang_vẻ sang_trọng thiết_kế gọn_nhẹ , trọng_lượng 14 kg chắc_hẳn trợ_thủ đắc_lực luôn_luôn đi cpu i7 - 1355u card đồ_họa intel uhd chắc_hẳn giúp giải_quyết ổn thỏa tác vụ văn_phòng ổ_cứng ssd 512gb ram 16gb không_gian lưu_trữ rộng_lớn tốc_độ truy_cập nhanh_chóng đa_dạng cổng kết_nối đem thuận_tiện truyền xuất dữ_liệu : cổng type c , usb 20 , usb 32 , hdmi , "
Van phong,"thiết_kế mới_mẻ lớp áo xanh dương thời_thượng màn_hình 141 inch full hd giúp hiển_thị sắc nét , màu_sắc chân_thực cpu intel core i5 - 1235u mạnh_mẽ cân tác vụ học_tập , văn_phòng ram 8gb chuẩn ddr4 hỗ_trợ duyệt web nhanh_chóng lo lag , giật không_gian lưu_trữ rộng_rãi giúp lưu_trữ tệp , tài_liệu ổ_cứng 512 gb "
Gaming,"màn_hình 156 inch tần_số quét 144hz giúp lỡ bất_cứ pha hành_động cpu intel core i7 - 12650h sức_mạnh ấn_tượng công_việc lẫn tựa game gpu rtx 4060 hỗ_trợ game mượt_mà fps cực ram 8gb ổ_cứng 512gb ssd hỗ_trợ lưu_trữ game , máy cực mướt bàn_phím đèn led hỗ_trợ rgb 4 zone giúp trận combat nảy_lửa sôi_động "
Van phong,"máy_phủ lớp sơn bạc thời_thượng khung vỏ chắc_chắn cpu intel core i5 1355u vận_hành hoàn_hảo công_việc văn_phòng card intel iris xe graphics xử_lý chuyên_nghiệp tác vụ chỉnh_sửa hình_ảnh , thiết_kế poster , banner ,  hỗ_trợ cảm_ứng đa giúp thao_tác dễ_dàng chuột trang_bị bảo_mật vân bảo_mật thông_tin , hình_ảnh an_toàn "
Sinh vien,"chip i5 - 1340p đồ_họa intel iris xe graphics giúp có_thể chiến tựa game nhẹ , chỉnh_sửa hình_ảnh màn_hình 16 inch độ phân_giải wqxga độ phủ màu dci - p3 99 % giúp hình_ảnh , video trở_nên sắc nét , chân_thật trang_bị cổng kết_nối , giúp thuận_tiện kết_nối truyền_tải dữ_liệu - cổng usb type c , usb type a , hdmi , dc - in thiết_kế kiểu_dáng gọn_nhẹ , sang_trọng , trọng_lượng 1199 kg giúp dễ_dàng "
Van phong,"màn_hình 156 inch full hd khung ảnh sắc nét , chân_thực màn_hình chống chói giúp làm_việc chói mắt cpu intel core i3 - 1115g4 vận_hành tác vụ văn_phòng card intel uhd graphics đáp_ứng ổn_định thao_tác thiết_kế đồ_họa cơ_bản photoshop , canva ,  ram 8 gb đa_nhiệm mượt_mà , nâng hiệu_suất làm_việc ổ_cứng 512gb ssd hỗ_trợ không_gian lưu_trữ rộng_rãi "
Sinh vien,"thiết_kế thanh_lịch , phù_hợp dân văn_phòng - vỏ kim_loại , 165 kg 16gb ram onboard , core i5 thế_hệ 11 - chạy mượt phần_mềm word , photoshop , tốc_độ động nhanh_chóng - 512gb ssd , có_thể tháo lắp ổ tối_đa 1tb độ phủ màu 100 % srgb - chỉnh ảnh phim thả ga "
Van phong,"chip i5 - 1340p kết_hợp intel iris xe graphics đem tiện_ích giải_quyết công_việc văn_phòng chỉnh_sửa nhẹ hình_ảnh màn_hình 14 inch kết_hợp độ phủ màu dci - p3 99 % công_nghệ chống chói giúp trải nghiệm hình_ảnh sống_động bảo_vệ đôi mắt ram 16gb ổ_cứng ssd 512gb giúp tự_tin lưu_trữ dữ_liệu sợ thiết_kế laptop mỏng nhẹ , trọng_lượng 125 kg , dễ_dàng lo vai "
Sinh vien,"sở_hữu thiết_kế mỏng nhẹ trọng_lượng 145 kg khả_năng linh_hoạt sử_dụng cpu intel core i5 - 1235u hỗ_trợ giải_quyết gọn tác vụ học_tập , văn_phòng ram 8gb chuẩn ddr4 giúp mở_hàng chục tabs chrome lo lag , giật dung_lượng lưu_trữ rộng_rãi , lưu_trữ file , dữ_liệu học_tập , 512gb ssd trang_bị kết_nối wifi 6 tự_động kết_nối tín_hiệu wifi , đảm_bảo kết_nối ổn_định , nhanh_chóng "
Sinh vien,"ram 8gb - giúp chạy mượt ứng_dụng hằng , có_thể tháo nâng_cấp tối_đa nâng_cấp thiết_kế chắc_chắn , thanh_lịch - 174 kg geforce ® mx550 2gb - edit ảnh nhẹ_nhàng pts , chiến tựa game lol , fifa màn_hình 156 inch , độ phân_giải full hd - chất_lượng hiển_thị rõ_ràng "
Sinh vien,"chip core i3 tiger lake - 1115g4 card intel uhd graphics chạy tác vụ văn_phòng chỉnh_sửa ảnh cơ_bản pts  ram 8gb , ổ_cứng ssd 256gb tốc_độ xử_lý đa_nhiệm mượt_mà  màn_hình 140 inch độ phân_giải full hd chất_lượng hiển_thị sắc nét  loa nahimic audio kết_hợp hi - res audio - trải nghiệm giải_trí chân_thật  tích_hợp web cam hd phép đàm_thoại thông_qua video thoải_mái  thiết_kế vỏ kim_loại cứng_cáp , 13 kg thuận_tiện di_chuyển ,  máy đi kèm windows 10 bản_quyền  "
Van phong,""" chip r5 - 5500u card đồ_họa rời amd radeon graphics chạy tác vụ văn_phòng chỉnh_sửa ảnh cơ_bản pts ram 16gb ổ_cứng 512gb ssd bộ_nhớ rộng_rãi , tốc_độ xử_lý đa_nhiệm mượt_mà màn_hình 140 inches 60hz độ phân_giải full hd ips chất_lượng hiển_thị nét , mượt_mà tích_hợp web cam hd 720p phép đàm_thoại thông_qua video thoải_mái thiết_kế vỏ kim_loại chắc_chắn , 119 kg thuận_tiện di_chuyển máy đi kèm windows 11 home bản_quyền "" "
Sinh vien,"cpu intel core i5 1135g7 xử_lý mượt_mà tác vụ lướt web , soạn_thảo săn , phim , giải_trí bộ_nhớ ram 8 gb đáp_ứng tác vụ học_tập , làm_việc văn_phòng card đồ_họa iris xe graphics dễ_dàng sử_dụng đồ_họa cơ_bản , chẳng_hạn video , phim chỉnh_sửa hình_ảnh đơn_giản ổ_cứng ssd 512 gb rộng_rãi , thoải_mái lưu_trữ tài_liệu học_tập , phim_ảnh màn_hình 156 inch full hd rộng_lớn mắt chất_lượng hình_ảnh hiển_thị nét , trung_thực "
Van phong,"chip ryzen 5 - 5600h card rời rtx ™ 3050 chạy mượt phần_mềm đồ_hoạ autocad , revit edit video premier dung_lượng ram 16gb , 512gb ssd - tab trình_duyệt ứng_dụng kích_thước 140 inches độ phân_giải 2k ( quad hd ) , tần_số quét 90hz - mượt_mà khung_hình tích_hợp webcam hd 720p phép đàm_thoại thông_qua video thoải_mái cổng kết_nối đa_dạng - thuận_tiện thiết_kế vỏ nhựa cứng_cáp , 145 kg thuận_tiện di_chuyển ,  máy đi kèm windows 11 bản_quyền "
Van phong,"sở_hữu tone màu xanh đen đẹp_mắt thiết_kế màn_hình gập 180 độ dễ_dàng chia_sẻ thông_tin đối_diện vi xử_lý intel core i3 - 1220p mạnh_mẽ giải_quyết tác vụ văn_phòng cơ_bản nâng việc_làm đồ_họa cơ_bản máy hỗ_trợ vga intel uhd graphics màn_hình 14 inch full hd , độ 300 nits hỗ_trợ hiển_thị điều_kiện ánh_sáng tích_hợp bảo_mật vân , khóa máy chạm "
Van phong,"màn_hình 156 inch kết_hợp công_nghệ chống chói giúp hoạt_động máy_tính chói mắt cpu i3 - 1315u giúp xử_lý hiệu_quả công_việc văn_phòng chỉnh_sửa ảnh nhẹ pts ổ_cứng ssd 512gb giúp không_gian lưu_trữ dữ_liệu , tài_liệu thiết_kế laptop kiểu_dáng thanh_lịch , sang_trọng , phù_hợp đối_tượng trang_bị khả_năng bảo_mật vân giúp bảo_vệ thông_tin bản_thân an_toàn "
Van phong,"siêu mỏng nhẹ , 999g - sẵn_sàng đồng_hành chuyến đi bàn_phím trang_bị led - sẵn_sàng làm_việc chip intel core i5 , ssd 512gb - khả_năng xử_lý cực , mượt_mà tác vụ âm_thanh sống_động - công_nghệ âm_thanh dts : x ultra chất_lượng âm_nhạc chân_thật "
